{
  "sample_id": "golden_03_niche_like",
  "seed": 103,
  "split": "test",
  "image_width": 320,
  "image_height": 320,
  "image_ref": "data/synthetic/fixtures/golden_03_niche_like.jpg",
  "mask_ref": "masks/test/golden_03_niche_like_mask.png",
  "generator_version": "procedural-motif-generator-v1.0.0",
  "registry_version": "synthetic-motif-registry-v1.0.0",
  "scene_signature": "0f7d14fe3e129c324e5aa23c41fa5aa88a83de4ff8d6d698cf7327de8420bffe",
  "scene_spec": {
    "layout_type": "ALLOVER_LATTICE",
    "width": 320,
    "height": 320,
    "instance_count": 2,
    "keys_present": [
      "niche_like",
      "lattice_like"
    ],
    "border_width": 41
  },
  "randomization_profile": {},
  "artifact_hashes": {},
  "instances": [
    {
      "instance_id": "inst_0001_lattice_like",
      "visual_candidate_key": "lattice_like",
      "bbox_xyxy": [
        81.90655891401191,
        81.90655891401191,
        238.0934410859881,
        238.0934410859881
      ],
      "bbox_normalized": [
        0.2559579966062872,
        0.2559579966062872,
        0.7440420033937128,
        0.7440420033937128
      ],
      "polygon": [
        [
          160.0,
          81.90655891401191
        ],
        [
          199.04672054299405,
          120.95327945700595
        ],
        [
          238.0934410859881,
          160.0
        ],
        [
          199.04672054299405,
          199.04672054299405
        ],
        [
          160.0,
          238.0934410859881
        ],
        [
          120.95327945700595,
          199.04672054299405
        ],
        [
          81.90655891401191,
          160.0
        ],
        [
          120.95327945700595,
          120.95327945700595
        ]
      ],
      "obb": [
        [
          160.0,
          238.09347534179688
        ],
        [
          81.90653991699219,
          160.00003051757812
        ],
        [
          160.0,
          81.90658569335938
        ],
        [
          238.0934600830078,
          160.00003051757812
        ]
      ],
      "obb_normalized": [
        [
          0.5,
          0.7440421104431152
        ],
        [
          0.25595793724060056,
          0.5000000953674316
        ],
        [
          0.5,
          0.25595808029174805
        ],
        [
          0.7440420627593994,
          0.5000000953674316
        ]
      ],
      "mask_ref": null,
      "full_geometry": [
        [
          160.0,
          81.90655891401191
        ],
        [
          199.04672054299405,
          120.95327945700595
        ],
        [
          238.0934410859881,
          160.0
        ],
        [
          199.04672054299405,
          199.04672054299405
        ],
        [
          160.0,
          238.0934410859881
        ],
        [
          120.95327945700595,
          199.04672054299405
        ],
        [
          81.90655891401191,
          160.0
        ],
        [
          120.95327945700595,
          120.95327945700595
        ]
      ],
      "visible_fraction": 1.0,
      "is_truncated": false,
      "is_occluded": false,
      "ignore": false,
      "render_parameters": {
        "cx": 160.0,
        "cy": 160.0,
        "radius": 104.12458811465079,
        "layout_role": "lattice_field"
      },
      "transform_provenance": {
        "stage": "composer_canonical"
      }
    },
    {
      "instance_id": "inst_0002_niche_like",
      "visual_candidate_key": "niche_like",
      "bbox_xyxy": [
        134.48947591191057,
        127.200754743885,
        185.51052408808943,
        192.799245256115
      ],
      "bbox_normalized": [
        0.42027961222472054,
        0.3975023585746406,
        0.5797203877752795,
        0.6024976414253593
      ],
      "polygon": [
        [
          134.48947591191057,
          192.799245256115
        ],
        [
          140.61200169305204,
          192.799245256115
        ],
        [
          140.61200169305204,
          160.0
        ],
        [
          140.61200169305204,
          160.0
        ],
        [
          140.90654895193006,
          156.58268249945496
        ],
        [
          141.7812410591513,
          153.26919846191788
        ],
        [
          143.20950093765336,
          150.1602264231655
        ],
        [
          145.14793163376234,
          147.35023092537958
        ],
        [
          147.53763491167024,
          144.92459225983396
        ],
        [
          150.30600084652602,
          142.9570122299489
        ],
        [
          153.36891404025982,
          141.50727475928892
        ],
        [
          156.63330942538894,
          140.61942938729743
        ],
        [
          160.0,
          140.320452846331
        ],
        [
          160.0,
          140.320452846331
        ],
        [
          163.36669057461106,
          140.61942938729743
        ],
        [
          166.63108595974018,
          141.50727475928892
        ],
        [
          169.69399915347398,
          142.9570122299489
        ],
        [
          172.46236508832976,
          144.92459225983396
        ],
        [
          174.85206836623766,
          147.35023092537958
        ],
        [
          176.79049906234664,
          150.1602264231655
        ],
        [
          178.2187589408487,
          153.26919846191788
        ],
        [
          179.09345104806994,
          156.58268249945496
        ],
        [
          179.38799830694796,
          160.0
        ],
        [
          179.38799830694796,
          160.0
        ],
        [
          179.38799830694796,
          192.799245256115
        ],
        [
          185.51052408808943,
          192.799245256115
        ],
        [
          185.51052408808943,
          127.200754743885
        ],
        [
          134.48947591191057,
          127.200754743885
        ]
      ],
      "obb": [
        [
          185.51052856445312,
          192.7992401123047
        ],
        [
          134.48947143554688,
          192.7992401123047
        ],
        [
          134.48947143554688,
          127.20075988769531
        ],
        [
          185.51052856445312,
          127.20075988769531
        ]
      ],
      "obb_normalized": [
        [
          0.579720401763916,
          0.6024976253509522
        ],
        [
          0.42027959823608396,
          0.6024976253509522
        ],
        [
          0.42027959823608396,
          0.39750237464904786
        ],
        [
          0.579720401763916,
          0.39750237464904786
        ]
      ],
      "mask_ref": null,
      "full_geometry": [
        [
          134.48947591191057,
          192.799245256115
        ],
        [
          140.61200169305204,
          192.799245256115
        ],
        [
          140.61200169305204,
          160.0
        ],
        [
          140.61200169305204,
          160.0
        ],
        [
          140.90654895193006,
          156.58268249945496
        ],
        [
          141.7812410591513,
          153.26919846191788
        ],
        [
          143.20950093765336,
          150.1602264231655
        ],
        [
          145.14793163376234,
          147.35023092537958
        ],
        [
          147.53763491167024,
          144.92459225983396
        ],
        [
          150.30600084652602,
          142.9570122299489
        ],
        [
          153.36891404025982,
          141.50727475928892
        ],
        [
          156.63330942538894,
          140.61942938729743
        ],
        [
          160.0,
          140.320452846331
        ],
        [
          160.0,
          140.320452846331
        ],
        [
          163.36669057461106,
          140.61942938729743
        ],
        [
          166.63108595974018,
          141.50727475928892
        ],
        [
          169.69399915347398,
          142.9570122299489
        ],
        [
          172.46236508832976,
          144.92459225983396
        ],
        [
          174.85206836623766,
          147.35023092537958
        ],
        [
          176.79049906234664,
          150.1602264231655
        ],
        [
          178.2187589408487,
          153.26919846191788
        ],
        [
          179.09345104806994,
          156.58268249945496
        ],
        [
          179.38799830694796,
          160.0
        ],
        [
          179.38799830694796,
          160.0
        ],
        [
          179.38799830694796,
          192.799245256115
        ],
        [
          185.51052408808943,
          192.799245256115
        ],
        [
          185.51052408808943,
          127.200754743885
        ],
        [
          134.48947591191057,
          127.200754743885
        ]
      ],
      "visible_fraction": 1.0,
      "is_truncated": false,
      "is_occluded": false,
      "ignore": false,
      "render_parameters": {
        "cx": 160.0,
        "cy": 160.0,
        "radius": 36.44360584012777,
        "layout_role": "lattice_focal"
      },
      "transform_provenance": {
        "stage": "composer_canonical"
      }
    }
  ]
}