{
  "sample_id": "golden_08_lattice_like",
  "seed": 108,
  "split": "test",
  "image_width": 320,
  "image_height": 320,
  "image_ref": "data/synthetic/fixtures/golden_08_lattice_like.jpg",
  "mask_ref": "masks/test/golden_08_lattice_like_mask.png",
  "generator_version": "procedural-motif-generator-v1.0.0",
  "registry_version": "synthetic-motif-registry-v1.0.0",
  "scene_signature": "de8c9907ea6f65dd00d82ec1507863bface3dc23a346a5c112af16a4eafa86ef",
  "scene_spec": {
    "layout_type": "ALLOVER_LATTICE",
    "width": 320,
    "height": 320,
    "instance_count": 2,
    "keys_present": [
      "lattice_like"
    ],
    "border_width": 36
  },
  "randomization_profile": {},
  "artifact_hashes": {},
  "instances": [
    {
      "instance_id": "inst_0001_lattice_like",
      "visual_candidate_key": "lattice_like",
      "bbox_xyxy": [
        80.10125712208625,
        80.10125712208625,
        239.89874287791375,
        239.89874287791375
      ],
      "bbox_normalized": [
        0.25031642850651953,
        0.25031642850651953,
        0.7496835714934804,
        0.7496835714934804
      ],
      "polygon": [
        [
          160.0,
          80.10125712208625
        ],
        [
          199.94937143895686,
          120.05062856104313
        ],
        [
          239.89874287791375,
          160.0
        ],
        [
          199.94937143895686,
          199.94937143895686
        ],
        [
          160.0,
          239.89874287791375
        ],
        [
          120.05062856104313,
          199.94937143895686
        ],
        [
          80.10125712208625,
          160.0
        ],
        [
          120.05062856104313,
          120.05062856104313
        ]
      ],
      "obb": [
        [
          160.0,
          239.89874267578125
        ],
        [
          80.10125732421875,
          160.0
        ],
        [
          160.0,
          80.10125732421875
        ],
        [
          239.89874267578125,
          160.0
        ]
      ],
      "obb_normalized": [
        [
          0.5,
          0.7496835708618164
        ],
        [
          0.2503164291381836,
          0.5
        ],
        [
          0.5,
          0.2503164291381836
        ],
        [
          0.7496835708618164,
          0.5
        ]
      ],
      "mask_ref": null,
      "full_geometry": [
        [
          160.0,
          80.10125712208625
        ],
        [
          199.94937143895686,
          120.05062856104313
        ],
        [
          239.89874287791375,
          160.0
        ],
        [
          199.94937143895686,
          199.94937143895686
        ],
        [
          160.0,
          239.89874287791375
        ],
        [
          120.05062856104313,
          199.94937143895686
        ],
        [
          80.10125712208625,
          160.0
        ],
        [
          120.05062856104313,
          120.05062856104313
        ]
      ],
      "visible_fraction": 1.0,
      "is_truncated": false,
      "is_occluded": false,
      "ignore": false,
      "render_parameters": {
        "cx": 160.0,
        "cy": 160.0,
        "radius": 106.53165717055165,
        "layout_role": "lattice_field"
      },
      "transform_provenance": {
        "stage": "composer_canonical"
      }
    },
    {
      "instance_id": "inst_0002_lattice_like",
      "visual_candidate_key": "lattice_like",
      "bbox_xyxy": [
        132.0354399927302,
        132.0354399927302,
        187.9645600072698,
        187.9645600072698
      ],
      "bbox_normalized": [
        0.41261074997728187,
        0.41261074997728187,
        0.5873892500227181,
        0.5873892500227181
      ],
      "polygon": [
        [
          160.0,
          132.0354399927302
        ],
        [
          173.9822800036349,
          146.0177199963651
        ],
        [
          187.9645600072698,
          160.0
        ],
        [
          173.9822800036349,
          173.9822800036349
        ],
        [
          160.0,
          187.9645600072698
        ],
        [
          146.0177199963651,
          173.9822800036349
        ],
        [
          132.0354399927302,
          160.0
        ],
        [
          146.0177199963651,
          146.0177199963651
        ]
      ],
      "obb": [
        [
          159.99996948242188,
          187.9645538330078
        ],
        [
          132.03543090820312,
          159.99998474121094
        ],
        [
          160.0,
          132.0354461669922
        ],
        [
          187.96453857421875,
          160.00001525878906
        ]
      ],
      "obb_normalized": [
        [
          0.4999999046325684,
          0.5873892307281494
        ],
        [
          0.4126107215881348,
          0.4999999523162842
        ],
        [
          0.5,
          0.4126107692718506
        ],
        [
          0.5873891830444335,
          0.5000000476837159
        ]
      ],
      "mask_ref": null,
      "full_geometry": [
        [
          160.0,
          132.0354399927302
        ],
        [
          173.9822800036349,
          146.0177199963651
        ],
        [
          187.9645600072698,
          160.0
        ],
        [
          173.9822800036349,
          173.9822800036349
        ],
        [
          160.0,
          187.9645600072698
        ],
        [
          146.0177199963651,
          173.9822800036349
        ],
        [
          132.0354399927302,
          160.0
        ],
        [
          146.0177199963651,
          146.0177199963651
        ]
      ],
      "visible_fraction": 1.0,
      "is_truncated": false,
      "is_occluded": false,
      "ignore": false,
      "render_parameters": {
        "cx": 160.0,
        "cy": 160.0,
        "radius": 37.28608000969307,
        "layout_role": "lattice_focal"
      },
      "transform_provenance": {
        "stage": "composer_canonical"
      }
    }
  ]
}