{
  "sample_id": "golden_01_star_like",
  "seed": 101,
  "split": "test",
  "image_width": 320,
  "image_height": 320,
  "image_ref": "data/synthetic/fixtures/golden_01_star_like.jpg",
  "mask_ref": "masks/test/golden_01_star_like_mask.png",
  "generator_version": "procedural-motif-generator-v1.0.0",
  "registry_version": "synthetic-motif-registry-v1.0.0",
  "scene_signature": "b7fd67934bcfae20dbb48490ae2432ae7431db1283f5c930dcd4efd0a85ffbce",
  "scene_spec": {
    "layout_type": "ALLOVER_LATTICE",
    "width": 320,
    "height": 320,
    "instance_count": 2,
    "keys_present": [
      "lattice_like",
      "star_like"
    ],
    "border_width": 38
  },
  "randomization_profile": {},
  "artifact_hashes": {},
  "instances": [
    {
      "instance_id": "inst_0001_lattice_like",
      "visual_candidate_key": "lattice_like",
      "bbox_xyxy": [
        63.18647529673416,
        63.18647529673416,
        256.81352470326584,
        256.81352470326584
      ],
      "bbox_normalized": [
        0.19745773530229424,
        0.19745773530229424,
        0.8025422646977057,
        0.8025422646977057
      ],
      "polygon": [
        [
          160.0,
          63.18647529673416
        ],
        [
          208.40676235163292,
          111.59323764836708
        ],
        [
          256.81352470326584,
          160.0
        ],
        [
          208.40676235163292,
          208.40676235163292
        ],
        [
          160.0,
          256.81352470326584
        ],
        [
          111.59323764836708,
          208.40676235163292
        ],
        [
          63.18647529673416,
          160.0
        ],
        [
          111.59323764836708,
          111.59323764836708
        ]
      ],
      "obb": [
        [
          160.00001525878906,
          256.81353759765625
        ],
        [
          63.18648147583008,
          160.0
        ],
        [
          160.00001525878906,
          63.18646240234375
        ],
        [
          256.81353759765625,
          160.0
        ]
      ],
      "obb_normalized": [
        [
          0.5000000476837159,
          0.8025423049926758
        ],
        [
          0.197457754611969,
          0.5
        ],
        [
          0.5000000476837159,
          0.1974576950073242
        ],
        [
          0.8025423049926758,
          0.5
        ]
      ],
      "mask_ref": null,
      "full_geometry": [
        [
          160.0,
          63.18647529673416
        ],
        [
          208.40676235163292,
          111.59323764836708
        ],
        [
          256.81352470326584,
          160.0
        ],
        [
          208.40676235163292,
          208.40676235163292
        ],
        [
          160.0,
          256.81352470326584
        ],
        [
          111.59323764836708,
          208.40676235163292
        ],
        [
          63.18647529673416,
          160.0
        ],
        [
          111.59323764836708,
          111.59323764836708
        ]
      ],
      "visible_fraction": 1.0,
      "is_truncated": false,
      "is_occluded": false,
      "ignore": false,
      "render_parameters": {
        "cx": 160.0,
        "cy": 160.0,
        "radius": 129.08469960435446,
        "layout_role": "lattice_field"
      },
      "transform_provenance": {
        "stage": "composer_canonical"
      }
    },
    {
      "instance_id": "inst_0002_star_like",
      "visual_candidate_key": "star_like",
      "bbox_xyxy": [
        114.82035513847595,
        114.82035513847595,
        205.17964486152405,
        205.17964486152405
      ],
      "bbox_normalized": [
        0.35881360980773735,
        0.35881360980773735,
        0.6411863901922626,
        0.6411863901922626
      ],
      "polygon": [
        [
          205.17964486152405,
          160.0
        ],
        [
          180.8702745868454,
          168.6447507843219
        ],
        [
          191.94683325318363,
          191.94683325318363
        ],
        [
          168.6447507843219,
          180.8702745868454
        ],
        [
          160.0,
          205.17964486152405
        ],
        [
          151.3552492156781,
          180.8702745868454
        ],
        [
          128.05316674681637,
          191.94683325318363
        ],
        [
          139.1297254131546,
          168.6447507843219
        ],
        [
          114.82035513847595,
          160.0
        ],
        [
          139.1297254131546,
          151.3552492156781
        ],
        [
          128.05316674681637,
          128.05316674681637
        ],
        [
          151.35524921567807,
          139.1297254131546
        ],
        [
          160.0,
          114.82035513847595
        ],
        [
          168.6447507843219,
          139.1297254131546
        ],
        [
          191.9468332531836,
          128.05316674681637
        ],
        [
          180.8702745868454,
          151.35524921567807
        ]
      ],
      "obb": [
        [
          137.41017150878906,
          214.5366668701172
        ],
        [
          105.46336364746094,
          137.41017150878906
        ],
        [
          182.58985900878906,
          105.46336364746094
        ],
        [
          214.5366668701172,
          182.58985900878906
        ]
      ],
      "obb_normalized": [
        [
          0.42940678596496584,
          0.6704270839691162
        ],
        [
          0.3295730113983154,
          0.42940678596496584
        ],
        [
          0.5705933094024658,
          0.3295730113983154
        ],
        [
          0.6704270839691162,
          0.5705933094024658
        ]
      ],
      "mask_ref": null,
      "full_geometry": [
        [
          205.17964486152405,
          160.0
        ],
        [
          180.8702745868454,
          168.6447507843219
        ],
        [
          191.94683325318363,
          191.94683325318363
        ],
        [
          168.6447507843219,
          180.8702745868454
        ],
        [
          160.0,
          205.17964486152405
        ],
        [
          151.3552492156781,
          180.8702745868454
        ],
        [
          128.05316674681637,
          191.94683325318363
        ],
        [
          139.1297254131546,
          168.6447507843219
        ],
        [
          114.82035513847595,
          160.0
        ],
        [
          139.1297254131546,
          151.3552492156781
        ],
        [
          128.05316674681637,
          128.05316674681637
        ],
        [
          151.35524921567807,
          139.1297254131546
        ],
        [
          160.0,
          114.82035513847595
        ],
        [
          168.6447507843219,
          139.1297254131546
        ],
        [
          191.9468332531836,
          128.05316674681637
        ],
        [
          180.8702745868454,
          151.35524921567807
        ]
      ],
      "visible_fraction": 1.0,
      "is_truncated": false,
      "is_occluded": false,
      "ignore": false,
      "render_parameters": {
        "cx": 160.0,
        "cy": 160.0,
        "radius": 45.179644861524054,
        "layout_role": "lattice_focal"
      },
      "transform_provenance": {
        "stage": "composer_canonical"
      }
    }
  ]
}